{
  "claim_ceiling": "C0_SOFTWARE_ONLY",
  "component_id": "dna_hinge/0b",
  "family": "dna_hinge",
  "function": "Compliant DNA hinge: взаимный угол плеч под внешним воздействием; в v0.1 измерено равновесное распределение угла при заданном протоколе (управляемый привод — предмет E5, не этой карточки)",
  "integrity": {
    "details": [
      "long_bond_fraction <= 0.1078: max 0.055951662",
      "pairs_fraction_v2 >= 0.50: min 0.980874317",
      "displacement <= 20.0: max 8.401379567",
      "energy |drift| total, max across replicas: 0.009862"
    ],
    "frames_valid": "150/150",
    "gates_passed": true,
    "notes": "гейты §4 E2_PROTO_R1"
  },
  "interfaces": {
    "arms": "два жёстких пучка (arm_a / arm_b), соединённые гибким шарнирным узлом; топология 112 цепей / 8378 нуклеотидов",
    "measurement_interface": "hinge angle по PCA-осям, конвенция [0,180] deg (E2_OBS1_SI_DECISION_R1; detector v2 mutual-nearest, frozen arm manifest)"
  },
  "kind": "nanolab_component_card",
  "known_gaps": [],
  "known_limitations": [
    "конвенция угла [0,180] по PCA-осям не имеет прямого соответствия SI статьи (U-obs-1 закрыт first-principles решением E2_OBS1_SI_DECISION_R1, не подгонкой под SI)",
    "v2-detector пар (mutual-nearest, window + antiparallel a1) — frozen-инструментальная конвенция, не авторский код",
    "coarse-grained модель oxDNA DNA2: количественное соответствие эксперименту не claim'ится (ceiling C0_SOFTWARE_ONLY/measured-only)",
    "long_bond_fraction baseline авторского конфига зафиксирован как есть (lbf max 0.0560 <= гейт 0.1078), денатюрация не моделировалась отдельно",
    "T 300 K vs авторские 298 K в части конфигов закрыта decision rule E2-SETUP-R1 §5 (reproduction arm = verbatim)"
  ],
  "measured_observables": {
    "hinge_angle_common_window_150k": {
      "convention": "та же конвенция угла; общий кросс-вариантный временной интервал 150k (addendum §8 item 3)",
      "digests": {},
      "distribution": {
        "note": "secondary cross-variant window; primary confirmatory 200k result NOT revised"
      },
      "estimate": 65.870460546,
      "n": 111,
      "source": "docs/work/executions/EX-NL3-002-SUMMARY-R1/evidence/parametric-summary.json",
      "uncertainty": [
        65.607023682,
        66.118300188
      ],
      "units": "deg"
    },
    "hinge_angle_confirmatory_200k": {
      "convention": "[0,180] deg, PCA axes, erratum R1 §2.5; detector v2 mutual-nearest + PCA hinge angle, frozen arm manifest",
      "digests": {},
      "distribution": {
        "bootstrap": {
          "resamples": 10000,
          "seed": 424242,
          "statistic": "median"
        },
        "bootstrap_ci95_deg": [
          65.674963662,
          66.318271836
        ],
        "iqr_deg": [
          64.93709665,
          67.056610879
        ],
        "per_replica_median_deg": {
          "E2-R1-C001": 65.095434789,
          "E2-R1-C002": 65.708669763,
          "E2-R1-C003": 67.236579608
        },
        "q05_q95_deg": [
          63.00066167,
          68.408819824
        ]
      },
      "estimate": 65.976921401,
      "n": 150,
      "source": "docs/work/executions/EX-NL3-002-R1/evidence/confirmatory-summary.json",
      "uncertainty": [
        65.674963662,
        66.318271836
      ],
      "units": "deg"
    }
  },
  "measurement_status": "MEASURED",
  "operating_range": {
    "model": "oxDNA DNA2 coarse-grained",
    "notes": "применимость ограничена измеренным протоколом; экстраполяция за его пределы не заявляется",
    "salt_concentration_M": 0.5,
    "temperature": "300 K (author config verbatim; decision rule E2-SETUP-R1 §5)"
  },
  "protocol_pins": {
    "engine": "oxDNA (CPU build, double precision)",
    "engine_commit": "00dc7fb9a25bbd8cadbc7503ee2b9f38983c6591",
    "model": "DNA2",
    "notes": "thermostat и integration — author config verbatim (pro_CPU.in)",
    "options": {
      "print_conf_interval": 4000,
      "print_energy_every": 100,
      "salt_concentration": 0.5
    },
    "platform": "WSL2 Ubuntu 24.04 (ENGINE_ENVIRONMENT_R1: gcc 13.3.0, cmake 3.31.6 user-local)",
    "protocol": "docs/research/E2_PROTO_R1.md (frozen before confirmatory runs); observables: docs/research/E2_OBSERVABLES_R2.md",
    "seeds": [
      201004,
      202008,
      203012
    ],
    "steps": 200000,
    "temperature": "300 K"
  },
  "provenance": {
    "card_generated_from": [
      "docs/work/executions/EX-NL3-002-SUMMARY-R1/evidence/component-card-0b.json",
      "docs/work/executions/EX-NL3-002-SUMMARY-R1/evidence/parametric-summary.json",
      "docs/work/executions/EX-NL3-002-R1/evidence/confirmatory-summary.json"
    ],
    "evidence_execution_id": "EX-NL3-002-SUMMARY-R1",
    "generation": "curated example for WO-NL5-001-A-R1; каждое число взято verbatim из опубликованного E2 evidence; НЕ является release-артефактом",
    "notes": "реальная сборка библиотеки — NL5-001-B"
  },
  "reproduction": {
    "expected": {
      "hinge_angle_common_window_150k": 65.870460546,
      "hinge_angle_confirmatory_200k": 65.976921401
    },
    "requires": [
      "oxDNA @ 00dc7fb9 (CPU build, double precision)",
      "python3 >= 3.10 (stdlib only)",
      "сетевой доступ для download-on-run по exact pinned commit (REFERENCE_ONLY)"
    ],
    "rights_constraints": "download-on-run по exact pinned commit; durable-cache запрещён; upstream-файлы не включены в пакет",
    "steps": [
      "1. download-on-run с digest-гейтом: size+blob_sha1+sha256 против source pins; выход ненулевой при mismatch",
      "2. сборка входов реплик: 0b.top/0b.conf verbatim + pro_CPU.in; seeds 201004/202008/203012; copy-checks SHA-256",
      "3. прогоны: CPU oxDNA @ 00dc7fb9, 3 реплики по 200000 steps",
      "4. анализ (frozen протокол): v2 mutual + гейты §4 + статистика §6, bootstrap 10000/seed 424242",
      "5. сравнение pooled median с expected в пределах CI карточки; расхождение вне CI — REPRODUCTION_MISMATCH"
    ],
    "tolerance_policy": "pooled median в пределах bootstrap CI95 карточки; гейты кадра §4 E2_PROTO_R1; не PASS при отсутствии проверки"
  },
  "rights": {
    "derived_results_publishable": true,
    "durable_cache": "FORBIDDEN",
    "notes": "G1 decision B: download-on-run по exact pinned commit, удаление после execution; пакет распространяет производные результаты NanoLab, а не upstream-файлы",
    "pinned_commit": "23fd1ff7731e9017bd776f49206dc42d70d9fe91",
    "rights_mode": "REFERENCE_ONLY",
    "upstream_repo": "gauravarya77/DNA-hinge-simulations"
  },
  "schema_version": 1,
  "scientific_outcome": "MEASURED (measured distributions; интерпретации угла и соответствия статье запрещены до отдельного решения; claim ceiling C0_SOFTWARE_ONLY/measured-only)",
  "source_provenance": {
    "digest_gate_result": "3/3 PASS (size + blob_sha1 обязательны; sha256 пин 0b верифицирован)",
    "digest_gates": {
      "MD_Hinges/0b.conf": {
        "blob_sha1": "181373f0eb16fb90b0b8c66fe5cbf658cc6134da",
        "sha256": "506c41fccd45c09958c5c74399b33018bb370719a32615dd57ed588f73bfd263",
        "sha256_status": "CONTENT_VERIFIED",
        "size_bytes": 2294162
      },
      "MD_Hinges/0b.top": {
        "blob_sha1": "84edad43593f1d5eb9debb9493a7bd86d743e44b",
        "sha256": "cd0461275e69a452cedba4586af55b1f8f6b857ab1737f374daf46c389aae01f",
        "sha256_status": "CONTENT_VERIFIED",
        "size_bytes": 120204
      }
    },
    "pinned_commit": "23fd1ff7731e9017bd776f49206dc42d70d9fe91",
    "upstream_repo": "gauravarya77/DNA-hinge-simulations"
  },
  "variant": "0b"
}
